Job Title,Position,Company,Job Type,Skill,Work Type,Industry Type,Seniority,City,Province,Min Salary,Max Salary
Binance Accelerator Program - Data Analyst (Risk),Data Analyst,Binance,Full-Time,"Python, Sql",Remote,Cryptocurrency Exchange,ANY,Remote,Undef,113750.0,140988.0
Business Analyst,Business Analyst,Canadian Nuclear Laboratories,Full-Time,"Power Bi, Power BI, Excel",Remote,Research,ANY,Remote,Undef,79185.0,97450.0
Geophysicist/Data Analyst,Data Analyst,Sander Geophysics Limited,Full-Time,Undef,In-Person,Others,ANY,Ottawa,ON,116721.0,121521.0
Business Intelligence Data Engineer,Data Engineer,"Maximus Services, LLC",Full-Time,"Fabric, Power BI, Sql, Machine Learning, Genesys, Python, R, Database",In-Person,Service,ANY,Toronto,ON,87875.0,105000.0
"Business Intelligence Specialist, Ft",Business Analyst,Niagara Health System,Full-Time,"Azure, Power BI, SQL, Aws",In-Person,Healthcare,Senior,Niagara,ON,115211.0,130332.0
Continuous Improvement Analyst,Others Analyst,IMP Group,Full-Time,Excel,In-Person,Others,ANY,Abbotsford,BC,52215.0,102460.0
It Business Process Analyst,IT Analyst,Ground Effects,Full-Time,"C#, Javascript, Sql, Database",In-Person,Others,ANY,Windsor,ON,68458.0,108140.0
Computer Programmer/Analyst,Programmer,The City of Vancouver,Full-Time,"Database, Sql, Power Platform, Ssis, Azure, Ssrs, Git, .Net, Python, Javascript",In-Person,Technology,ANY,Vancouver,BC,91145.0,107702.0
"Senior Developer, Business Intelligence",Business Analyst,Ontario Health,Full-Time,"Power Bi, Power Platform, Ssis, Sql, Big Data, Sas, Ssrs, Azure, Python, R",In-Person,Healthcare,Senior,Toronto,ON,79419.0,123037.0
Opgt Mod – One (1) Business Analyst – Senior,Business Analyst,Softline Technology,Full-Time,"Sql, Gap, Power BI",In-Person,Technology,Senior,Toronto,ON,87528.0,103356.0
Business Analyst/Quality Assurance Analyst,IT Analyst,DLL,Full-Time,"Jira, Excel, Reason, Database",In-Person,Others,ANY,Burlington,ON,75898.0,113847.0
Capital & Maintenance Program Analyst,AI Analyst,Toronto Hydro,Full-Time,"Gap, Vba, Excel, Sql",In-Person,Others,ANY,Toronto,ON,73122.0,77601.0
Computer Programmer/Analyst,Programmer,The City of Vancouver,Full-Time,"Database, Sql, Power Platform, Ssis, Azure, Ssrs, Git, .Net, Python, Javascript",In-Person,Technology,ANY,Vancouver,BC,99049.0,117041.0
Senior Policy Analyst,Policy Analyst,Insurance Council of BC,Full-Time,Undef,In-Person,Insurance,Senior,Vancouver,BC,89606.0,128809.0
Business Operations Analyst (1 Year Contract),Business Analyst,TMX Group Limited,Part-Time,Database,In-Person,Others,ANY,Toronto,ON,80166.0,88032.0
Senior Business Systems Analyst,Systems Analyst,Royal Bank of Canada,Full-Time,"Sql, Big Data, Gap, Jira, Database",In-Person,Finance,Senior,Toronto,ON,77708.0,121028.0
Research Analyst - Translational Addiction Research Laboratory,Research Analyst,Centre for Addiction and Mental Health,Full-Time,Database,In-Person,Healthcare,ANY,Toronto,ON,57158.0,76232.0
Payroll Analyst,Payroll Analyst,Cenovus Energy,Full-Time,Excel,In-Person,Energy,ANY,Calgary,AB,106239.0,127695.0
Lead Business Analyst,Business Analyst,Royal Bank of Canada,Full-Time,"Gap, Jira, Sql",In-Person,Finance,Senior,Vancouver,BC,66411.0,97316.0
Data Analyst,Data Analyst,Toronto Transit Commission,Full-Time,"Sql, Tableau, Python, Database, Excel, Power Bi, R",In-Person,Others,ANY,Toronto,ON,83192.0,104013.0
Hr Technology Lead And Data Analyst,Data Analyst,City of Barrie,Full-Time,"Excel, Reason",In-Person,Government,Senior,Barrie,ON,108700.0,145641.0
Business Data Analyst,Data Analyst,Accencis Group,Full-Time,Undef,In-Person,Others,ANY,Richmond Hill,ON,90480.0,94421.0
(Data-Driven) Marketing Analyst,Others Analyst,Weyburn Credit Union,Full-Time,"Html, Tableau, Sql, Css, Python, Javascript, R, Power BI",In-Person,Media,ANY,Weyburn,SK,61181.0,76458.0
Quality Analyst,IT Analyst,Closing the Gap Healthcare,Full-Time,"Gap, Power BI, Excel",In-Person,Healthcare,ANY,Mississauga,ON,29819.0,101885.0
Technology Risk Analyst,Risk Analyst,BMO Financial Group,Full-Time,Undef,In-Person,Finance,ANY,Toronto,ON,74800.0,138600.0
Business Analyst,Business Analyst,Banff Caribou Properties Ltd.,Full-Time,Sql,In-Person,Others,ANY,Banff,AB,84986.0,99282.0
Technical Support Analyst ,Others Analyst,Seequent,Full-Time,Database,In-Person,Others,ANY,Toronto,ON,128756.0,129571.0
Technical Support Analyst – It / Database Management,IT Analyst,Seequent,Full-Time,Database,In-Person,Others,ANY,Toronto,ON,44545.0,87636.0
Bioinformatics Systems Analyst,Systems Analyst,University of Alberta,Full-Time,"Machine Learning, Database, Database, Html, Git, Matlab, Javascript, Perl, Css, Java, Python, R",In-Person,Education,ANY,Edmonton,AB,54764.0,73940.0
Senior Systems Analyst,Systems Analyst,Mackenzie Financial Corporation,Full-Time,Sql,In-Person,Technology,Senior,Greater Toronto Area,ON,107295.0,117267.0
Payroll Analyst,Payroll Analyst,CloudMD Software & Services Inc - CAN,Full-Time,"Excel, Reason, Database",Remote,Service,ANY,Remote,Undef,45000.0,50000.0
"Analyst, Business Procurement",Business Analyst,Banque Laurentienne,Full-Time,Excel,In-Person,Others,ANY,Montréal,QC,105568.0,112599.0
Policy Analyst,Policy Analyst,B.C. College of Nurses and Midwives,Full-Time,"C#, Forth, Excel",In-Person,Education,ANY,Vancouver,BC,104423.0,109644.0
Payroll Analyst,Payroll Analyst,CloudMD Software & Services Inc - CAN,Full-Time,"Excel, Reason, Database",Remote,Service,ANY,Beauceville,QC,45000.0,50000.0
Bilingual Senior Analyst Corporate Investigations,Others Analyst,Canada Life Assurance Company,Full-Time,"Power Bi, Excel",In-Person,Insurance,Senior,London,ON,54500.0,81800.0
Payroll Analyst,Payroll Analyst,CloudMD Software & Services Inc - CAN,Full-Time,"Excel, Reason, Database",Remote,Service,ANY,Charlottetown,PE,45000.0,50000.0
Sustainability Analyst,AI Analyst,KeeWee,Full-Time,"Python, Excel",Remote,Others,ANY,Remote,Undef,53745.0,85304.0
Data Analyst - Informatics And Systems,Data Analyst,Snaplii,Full-Time,"Tableau, Machine Learning, Sql, Database, Excel, Sas, Power Bi, Javascript, Spss",In-Person,Others,ANY,Mississauga,ON,36998.0,87695.0
C-Ge-916 – Data Analyst,Data Analyst,CAE,Full-Time,"Power BI, Confluence",In-Person,Others,ANY,Saint-Laurent,QC,99227.0,126329.0
Advanced Data Analyst - Frostbite,Data Analyst,Electronic Arts,Full-Time,"Sql, Aws, Databricks, Gap, Azure, Power Bi, Python",In-Person,Others,Senior,Vancouver,BC,107600.0,147100.0
"Analyst, Human Resources Analytics",Others Analyst,Ontario Health,Full-Time,Excel,In-Person,Healthcare,ANY,Toronto,ON,98504.0,105985.0
Technical Data Analyst,Data Analyst,CNOOC International,Full-Time,"Database, Excel, Power Bi, Python, R, Database",In-Person,Others,ANY,Calgary,AB,51017.0,93315.0
Data Analyst - Product,Data Analyst,Appcast,Full-Time,"Tableau, Machine Learning, Sql, Excel, Python",In-Person,Others,ANY,Fredericton,NB,45071.0,99672.0
Data Business Analyst,Business Analyst,"Bridgenext, Inc",Full-Time,"Azure, Sql, Python, Tableau, Excel, Databricks, Power Bi, Database",Remote,Technology,ANY,Remote,Undef,60540.0,140134.0
Data Management Analyst,Others Analyst,Leonardo DRS,Full-Time,Undef,In-Person,Others,ANY,Bedford,NS,61888.0,117634.0
Business Intelligence Analyst,Business Analyst,Autodesk,Full-Time,"Tableau, Sql, D3.Js, Power Bi, Python, R",In-Person,Others,ANY,Toronto,ON,42159.0,110128.0
Research Analyst,Research Analyst,Insurance Bureau of Canada,Full-Time,"Excel, Excel",In-Person,Insurance,ANY,Toronto,ON,66260.0,114581.0
Part-Time Data Quality Analyst (Fraud Investigation),IT Analyst,owl.co,Full-Time,Undef,Remote,Others,ANY,Toronto,ON,41600.0,100423.0
It Cost Business Analyst,IT Analyst,Ingersoll Rand,Full-Time,Excel,In-Person,Others,ANY,Barrie,ON,53612.0,98105.0
"Analyst, Business Intelligence",Business Analyst,Bell,Full-Time,"Sql, Confluence, Sas, Jira, Teradata",In-Person,Others,ANY,Toronto,ON,78889.0,95987.0
Senior Data Engineering Analyst,Data Engineer,Loblaw Companies Limited,Full-Time,"Sql, Python, Confluence, Excel, Java, Teradata, Jira",In-Person,Others,Senior,Brampton,ON,69991.0,112778.0
Principal Services Operations Analyst,Others Analyst,Dayforce,Full-Time,"Power Bi, Excel, Database",Remote,Others,Senior,Remote,Undef,83500.0,149300.0
Senior Systems Analyst,Systems Analyst,IG Wealth Management,Full-Time,Sql,In-Person,Others,Senior,Toronto,ON,79816.0,88661.0
Treasury Data Analyst,Data Analyst,GFL Environmental,Full-Time,"Sql, Database, Crystal, Excel",In-Person,Environment,ANY,Vaughan,ON,58240.0,146014.0
Business Intelligence Specialist,Business Analyst,Ramp Group,Full-Time,Undef,In-Person,Others,Senior,Surrey,BC,95680.0,119309.0
Senior Business Analyst,Business Analyst,Evolution Mining,Full-Time,Undef,In-Person,Freeport,Senior,Red Lake,ON,63327.0,84536.0
Associate It Business Analyst,IT Analyst,Manulife,Full-Time,Database,In-Person,Insurance,Mid,Toronto,ON,59570.0,110630.0
Decision Support Analyst,Others Analyst,ErinoakKids Center for Treatment and Development,Full-Time,"Sql, Excel, Database",In-Person,Construction,ANY,Mississauga,ON,55043.0,83240.0
"Analyst, Digital Advisory Federal Government",IT Analyst,MNP,Full-Time,Excel,In-Person,Others,ANY,Ottawa,ON,40531.0,98399.0
Data-Driven Marketing Analyst,Others Analyst,Weyburn Credit Union,Full-Time,"Html, Tableau, Sql, Css, Python, Javascript, R, Power BI",In-Person,Media,ANY,Weyburn,SK,61181.0,76458.0
Fpss Quality Coordination Analyst,IT Analyst,City of Winnipeg,Full-Time,"Crystal, Excel, Database",In-Person,Government,ANY,Winnipeg,MB,41920.0,121200.0
"Analyst, Business - Computer Systems",Systems Analyst,TechVest Global Solutions Inc.,Full-Time,Undef,In-Person,Technology,ANY,Toronto,ON,105000.0,123311.0
"Business Systems Analyst 10 Yrs (Sql, Big Data, Credit Risk, Banking Loan Book, Python)",Systems Analyst,Compest Solutions Inc,Full-Time,"Sql, Big Data, Hadoop, Python, Jupyter",In-Person,Technology,ANY,Toronto,ON,104000.0,120640.0
Admn O 24R - Policy Analyst,Policy Analyst,BC Public Service,Full-Time,Eagle,In-Person,Service,ANY,Abbotsford,BC,76071.0,86658.0
"Analyst, Business Performance, Bilingual Or English",Business Analyst,Nordia,Full-Time,Undef,In-Person,Others,ANY,Laval,QC,80593.0,87605.0
Business Intelligence Specialist,Business Analyst,RAMP Technology Group Inc.,Full-Time,"Github, Aws, Sql",In-Person,Technology,Senior,Surrey,BC,95680.0,131746.0
Continuous Improvement/Business Analyst,Business Analyst,FleetOptics Inc,Full-Time,"Power Bi, Excel",In-Person,Technology,ANY,Mississauga,ON,86767.0,120679.0
Research Analyst,Research Analyst,University of Toronto,Full-Time,"Sas, Big Data, R",In-Person,Education,ANY,Toronto,ON,75223.0,96196.0
"Analyst, Transaction Management",Others Analyst,Groupe Optimum Inc.,Full-Time,Excel,In-Person,Technology,ANY,Montréal,QC,100000.0,107622.0
Business Systems Analyst (Computer Services Officer 3),Systems Analyst,Province of Nova Scotia,Full-Time,Power Platform,In-Person,Technology,ANY,Halifax,NS,69000.0,84021.0
"Business Systems Analyst, Capital Markets Technology, Derivative Products",Systems Analyst,Scotiabank,Full-Time,"Sql, Gap, Excel",In-Person,Finance,ANY,Toronto,ON,73277.0,115705.0
Business Analyst Manager,Business Analyst,Midland Transport,Full-Time,Excel,In-Person,Real Estate,ANY,Dieppe,NB,79234.0,106139.0
Senior Business Intelligence Specialist,Business Analyst,Tolko Industries Ltd.,Full-Time,"Fabric, Ssis, Sql, Databricks, Azure, Ssrs",In-Person,Industry,Senior,Vernon,BC,79500.0,106000.0
"Analyst Sr, Strategy & Business Dev.",Strategy Analyst,Bombardier,Full-Time,Undef,In-Person,Others,Senior,Dorval,QC,57325.0,102516.0
Teknaform Senior Business Analyst,Business Analyst,Teknaform Inc.,Full-Time,Excel,In-Person,Technology,Senior,Bolton,ON,90000.0,110000.0
Senior Business Analyst,Business Analyst,Ivey Business School Foundation,Full-Time,Sql,In-Person,Education,Senior,London,ON,82800.0,103500.0
Contact Center Business Analyst,Business Analyst,Global Excel Management,Full-Time,"Genesys, Excel",In-Person,Others,ANY,Sherbrooke,QC,64318.0,96834.0
Investment Reporting Analyst,Others Analyst,OMERS,Full-Time,"Power Bi, Excel, SQL",In-Person,Others,ANY,Toronto,ON,71742.0,115986.0
"Analyst, Capital Gov & Reporting",IT Analyst,EPCOR,Full-Time,"Power Bi, Excel",In-Person,Others,ANY,Edmonton,AB,107931.0,128814.0
Marketing Analyst,Others Analyst,OLIVER Agency - North America,Full-Time,"Tableau, Power Bi, Sql, Excel, Vba, Python, R",In-Person,Agency,ANY,Toronto,ON,49097.0,112237.0
"Analyst, Marketing",Others Analyst,Wipro Comnet Inc.,Full-Time,Database,In-Person,Technology,ANY,Brampton,ON,79040.0,106875.0
Project Analyst,Others Analyst,ARYZE Developments Inc.,Full-Time,Excel,In-Person,Technology,ANY,Victoria,BC,68000.0,85000.0
Business Systems Analyst,Systems Analyst,AIR TRAIN FREIGHT SYSTEMS INC,Full-Time,Undef,In-Person,Technology,ANY,Mississauga,ON,59072.0,98447.0
Pricing & Revenue Management Analyst,Others Analyst,Flair Airlines Ltd.,Full-Time,Crystal,In-Person,Others,ANY,Vancouver,BC,90911.0,112742.0
Business Analyst,Business Analyst,TC Energie,Full-Time,"Power Bi, Power Platform",In-Person,Others,ANY,Calgary,AB,80658.0,99740.0
Marketing Science Analyst,Others Analyst,Lululemon,Full-Time,"Python, Sql, Power BI, R",In-Person,Others,ANY,Vancouver,BC,105800.0,138800.0
Business Systems Analyst,Systems Analyst,STAR TECH INFOSYSTEMS LTD.,Full-Time,C,In-Person,Technology,ANY,Calgary,AB,98176.0,143107.0
Ndt Eddy Current Data Analyst - Project Manager,Data Analyst,"Acuren Inspection, Inc.",Full-Time,Undef,In-Person,Technology,ANY,Edmonton,AB,43310.0,118362.0
Accounting Analyst And Supervisor,Others Analyst,Maggas Medical Inc.,Full-Time,Excel,In-Person,Healthcare,ANY,North York,ON,50000.0,70000.0
Sr. Pricing Analyst,Others Analyst,Collins Aerospace,Full-Time,Excel,In-Person,Aerospace,Senior,Oakville,ON,97895.0,106073.0
Business Systems Analyst,Systems Analyst,PressReader,Full-Time,"Power Platform, Power Bi, Excel, Database",In-Person,Media,ANY,Richmond,BC,70000.0,85000.0
"Senior Manager, Business Intelligence And Reporting, Enterprise Insider Risk Management",Business Analyst,TD Bank,Full-Time,"R, C",In-Person,Finance,Senior,Toronto,ON,66914.0,100177.0
"Senior Manager, Business Intelligence And Reporting, Enterprise Conduct Risk Management",Business Analyst,TD Bank,Full-Time,Undef,In-Person,Finance,Senior,Toronto,ON,62552.0,103336.0
Lead Business Systems Analyst (Sap Successfactors),Systems Analyst,Magic Leap - Multiple Locations,Full-Time,"C#, Database",Remote,Others,Senior,Remote,Undef,99023.0,106237.0
Treasury Analyst,Others Analyst,City of Richmond BC,Full-Time,Excel,In-Person,Government,ANY,Richmond,BC,83345.0,98404.0
Total Rewards Analyst,Others Analyst,SAIT Polytechnic,Full-Time,Excel,In-Person,Technology,ANY,Calgary,AB,65000.0,85000.0
"Fcm - Data Quality Analyst- Remote, Canada",IT Analyst,FCM,Full-Time,Power BI,Remote,Others,ANY,Remote,Undef,87000.0,120905.0
Data Analyst (Street Operations),Data Analyst,The City of Vancouver,Full-Time,"Power Bi, Excel, Big Data, Sql",In-Person,Technology,ANY,Vancouver,BC,87443.0,103272.0
Res O 21R - Data Analyst,Data Analyst,BC Public Service,Full-Time,"Python, Sql, R",In-Person,Service,ANY,Burnaby,BC,69760.0,79322.0
Data Analyst,Data Analyst,Fraser Health,Full-Time,"Sql, Sas, R, Tableau, Vbscript, Power Bi, Python",In-Person,Healthcare,ANY,Surrey,BC,79289.0,113984.0
Data Centre Analyst,Others Analyst,TransLink,Full-Time,C,In-Person,Others,ANY,Metro Vancouver Regional District,BC,95724.0,115116.0
Business Configuration Analyst,Business Analyst,Medavie Blue Cross,Full-Time,"Power BI, Sql",Remote,Others,ANY,Remote,Undef,78210.0,107884.0
Performance Data Analyst (Internal Only),Data Analyst,MacEwan University,Part-Time,"Database, Power Bi, Sql",In-Person,Education,Junior,Edmonton,AB,69898.0,101684.0
Business Intelligence Developer,Business Analyst,Novartis,Full-Time,"Power Bi, Sql, Alteryx, Snowflake, Database",In-Person,Others,ANY,Montréal,QC,86233.0,124168.0
Intermediate Data Support Analyst (6-Month Contract),Others Analyst,AGF Management Limited,Part-Time,"Eagle, Sql, Excel, Vba, Database",In-Person,Others,Mid,Toronto,ON,11028.0,77827.0
Program Data Analyst,Data Analyst,Nova Scotia School Boards (NSSB),Full-Time,Excel,In-Person,Education,ANY,Berwick,NS,46531.0,58164.0
Quantitative Data Analyst,Data Analyst,The Mustard Seed Society,Full-Time,"Tableau, Sql, Php, Excel, Power Bi, Python, Vba, R",In-Person,Others,ANY,Calgary,AB,73233.0,81051.0
Methods Analyst I - Wellness Data Analyst,Data Analyst,City of Edmonton,Full-Time,"Power Bi, Excel",In-Person,Government,ANY,Edmonton,AB,80928.0,101106.0
"Analyst, Local Sales Pricing",Others Analyst,SYSCO FOOD SERVICES,Full-Time,"Maple, Excel, Sql",Remote,Service,ANY,Moncton,NB,45016.0,93603.0
Jr. Qa Analyst,QA Analyst,indikor.com,Full-Time,"Sql, Github, C#, Gitlab, Javascript",Remote,Others,Junior,Remote,Undef,79226.0,83364.0
"Analyst, Local Sales Pricing",Others Analyst,SYSCO FOOD SERVICES,Full-Time,"Maple, Excel, Sql",Remote,Service,ANY,Mount Pearl,NL,45016.0,93603.0
"Analyst, Local Sales Pricing",Others Analyst,SYSCO FOOD SERVICES,Full-Time,"Maple, Excel, Sql",Remote,Service,ANY,Milton,ON,45016.0,93603.0
"Senior Analyst, Data Integration, Methods And Tools",Others Analyst,Canadian Institute for Health Information,Full-Time,"Python, R, Machine Learning",In-Person,Healthcare,Senior,Ottawa,ON,47405.0,153053.0
"Analyst, Local Sales Pricing",Others Analyst,SYSCO FOOD SERVICES,Full-Time,"Maple, Excel, Sql",Remote,Service,ANY,Boucherville,QC,45016.0,93603.0
"Business Data Analyst, Reporting & Audit",Data Analyst,PartnerRe,Full-Time,"Vba, Sql, Power Bi, Alteryx",In-Person,Others,ANY,Toronto,ON,92602.0,105274.0
"Analyst, Local Sales Pricing",Others Analyst,SYSCO FOOD SERVICES,Full-Time,"Maple, Excel, Sql",Remote,Service,ANY,Woodstock,ON,45016.0,93603.0
Business Systems Analyst (Technical),Systems Analyst,BMO Financial Group,Full-Time,"Database, Sql",In-Person,Finance,ANY,Toronto,ON,74800.0,138600.0
"Analyst, Local Sales Pricing",Others Analyst,SYSCO FOOD SERVICES,Full-Time,"Maple, Excel, Sql",Remote,Service,ANY,Ottawa,ON,45016.0,93603.0
Senior Business Analyst (Data),Business Analyst,Healthcare of Ontario Pension Plan (HOOPP),Full-Time,"Snowflake, Sql, Eagle",In-Person,Healthcare,Senior,Toronto,ON,62353.0,101287.0
Supply Chain & Master Data Analyst,Data Analyst,Longo's,Full-Time,"Excel, Factor",In-Person,Others,ANY,Vaughan,ON,56204.0,60469.0
"Business Analyst Student, Transportation Analytics (12 Months) - Fall 2024",Business Analyst,Canadian Tire Corporation,Full-Time,"Power Bi, Tableau, Excel, Sql",In-Person,Technology,ANY,Mississauga,ON,116721.0,149493.0
"Analyst, Local Sales Pricing",Others Analyst,SYSCO FOOD SERVICES,Full-Time,"Maple, Excel, Sql",Remote,Service,ANY,Kelowna,BC,45016.0,93603.0
"Analyst, Local Sales Pricing",Others Analyst,SYSCO FOOD SERVICES,Full-Time,"Maple, Excel, Sql",Remote,Service,ANY,Lakeside,NS,45016.0,93603.0
Business Analyst,Business Analyst,TC Energy,Full-Time,"Power Bi, Power Platform",In-Person,Energy,ANY,Calgary,AB,91039.0,139118.0
"Business Data Analyst, Retro Admin",Data Analyst,PartnerRe,Full-Time,"Vba, Sql, Alteryx",In-Person,Others,ANY,Toronto,ON,65170.0,72632.0
"Analyst, Local Sales Pricing",Others Analyst,SYSCO FOOD SERVICES,Full-Time,"Maple, Excel, Sql",Remote,Service,ANY,Mississauga,ON,45016.0,93603.0
Blue Box Analyst,Others Analyst,Canadian Tire Corporation,Full-Time,"Power Bi, Excel, Sql",In-Person,Technology,ANY,Toronto,ON,88522.0,103002.0
"Business Analyst Student, Courier Operations (12 Months) - Fall 2024",Business Analyst,Canadian Tire Corporation,Full-Time,"Tableau, Sql, Excel, Power Bi, Python",In-Person,Technology,ANY,Mississauga,ON,84063.0,106442.0
"Analyst, Local Sales Pricing",Others Analyst,SYSCO FOOD SERVICES,Full-Time,"Maple, Excel, Sql",Remote,Service,ANY,Winnipeg,MB,45016.0,93603.0
"Analyst, Global Investment Banking, Global Diversified Industries",Others Analyst,CIBC,Full-Time,Excel,In-Person,Others,ANY,Toronto,ON,91436.0,106262.0
"Analyst, Local Sales Pricing",Others Analyst,SYSCO FOOD SERVICES,Full-Time,"Maple, Excel, Sql",Remote,Service,ANY,Regina,SK,45016.0,93603.0
Business Intelligence Consulting Associate - Summer 2025,Business Analyst,RSM US LLP,Full-Time,"Sql, Database, Excel, SQL, Html, Database",In-Person,Others,Mid,Vancouver,BC,63800.0,76125.0
"Analyst, Local Sales Pricing",Others Analyst,SYSCO FOOD SERVICES,Full-Time,"Maple, Excel, Sql",Remote,Service,ANY,Victoria,BC,45016.0,93603.0
Programmer Analyst,Programmer,University of British Columbia,Full-Time,"Sql, Database, Tableau, Database, Power BI, Ssrs, C#, Qlikview, Excel",In-Person,Education,ANY,Vancouver,BC,80970.0,116417.0
"Analyst, Local Sales Pricing",Others Analyst,SYSCO FOOD SERVICES,Full-Time,"Maple, Excel, Sql",Remote,Service,ANY,Port Coquitlam,BC,45016.0,93603.0
"Analyst, Local Sales Pricing",Others Analyst,SYSCO FOOD SERVICES,Full-Time,"Maple, Excel, Sql",Remote,Service,ANY,Toronto,ON,45016.0,93603.0
Servicing Analyst,Others Analyst,BMO Financial Group,Full-Time,Undef,In-Person,Finance,ANY,Toronto,ON,37500.0,69500.0
Financial Data Analyst And Report Developer,Data Analyst,Stir Consulting Inc.,Full-Time,"Python, Vba, Sql",In-Person,Technology,ANY,Montréal,QC,104000.0,118548.0
"Analyst, Local Sales Pricing",Others Analyst,SYSCO FOOD SERVICES,Full-Time,"Maple, Excel, Sql",Remote,Service,ANY,Thunder Bay,ON,45016.0,93603.0
Senior Qa Analyst,QA Analyst,Viv Technologies Inc.,Full-Time,Undef,Remote,Technology,Senior,Toronto,ON,78656.0,105349.0
Principal Business Continuity Analyst,IT Analyst,Dayforce,Full-Time,Database,Remote,Others,Senior,Remote,Undef,83500.0,149300.0
"Analyst, Local Sales Pricing",Others Analyst,SYSCO FOOD SERVICES,Full-Time,"Maple, Excel, Sql",Remote,Service,ANY,Calgary,AB,45016.0,93603.0
It Business Analyst - Regular Full-Time,IT Analyst,District of Squamish,Full-Time,"C#, Database",In-Person,Others,ANY,Squamish,BC,87734.0,216320.0
"Business Systems Analyst, Capital Markets Technology, Hybrid",Systems Analyst,Scotiabank,Full-Time,"Sql, Perl, Shell, Python, Html, Excel, Gap, Java",Hybrid,Finance,ANY,Toronto,ON,50174.0,74130.0
"Analyst, Local Sales Pricing",Others Analyst,SYSCO FOOD SERVICES,Full-Time,"Maple, Excel, Sql",Remote,Service,ANY,Edmonton,AB,45016.0,93603.0
"Business Analyst, Servicenow, Scotiabank",Business Analyst,Scotiabank,Full-Time,Database,In-Person,Finance,ANY,Toronto,ON,76929.0,94443.0
Customs Compliance Analyst,Others Analyst,Panasonic Corporation,Full-Time,Excel,In-Person,Technology,ANY,Mississauga,ON,101745.0,137733.0
Business Analyst- Captial Markets @ Toronto - Hybrid - Fulltime,Business Analyst,Atlantis IT group,Full-Time,Undef,Hybrid,Technology,ANY,Toronto,ON,61943.0,105190.0
Database Analyst,Database Analyst,TEI Web Solutions,Full-Time,Database,In-Person,Consulting,ANY,North Vancouver,BC,79040.0,81120.0
"Senor. Analyst, People Process & Technology",Others Analyst,Loblaw Companies Limited,Full-Time,Undef,In-Person,Others,ANY,Brampton,ON,116192.0,138801.0
Asset Investment Analyst,Others Analyst,Toronto Hydro,Full-Time,"Database, Tableau, Sql, Alteryx, Python, R",In-Person,Others,ANY,Toronto,ON,55805.0,78453.0
"2024 Capital Markets, Global Credit, Fall Business Systems Analyst (4 Months)",Systems Analyst,Royal Bank of Canada,Full-Time,Undef,In-Person,Finance,ANY,Toronto,ON,82335.0,95995.0
Senior Allocations Analyst,Others Analyst,Arc'teryx,Full-Time,Excel,In-Person,Others,Senior,North Vancouver,BC,80000.0,100000.0
Functional Analyst,Others Analyst,Desjardins,Full-Time,Sas,In-Person,Others,ANY,Montréal,QC,58212.0,100218.0
Senior Business Analyst,Business Analyst,Port of Vancouver,Full-Time,"Excel, Jira",In-Person,Technology,Senior,Vancouver,BC,85522.0,88480.0
"Senior Analyst, Health Indicators And Client Support",Others Analyst,Canadian Institute for Health Information,Full-Time,"Python, Vue, Sas, Python",In-Person,Healthcare,Senior,Toronto,ON,79092.0,82145.0
"Technical Business Analyst, Capital Markets Technology With Credit Derivatives",IT Analyst,Scotiabank,Full-Time,"Sql, Gap, Excel",In-Person,Finance,ANY,Toronto,ON,50278.0,80587.0
"Senior Business Analyst, Gft",Business Analyst,Royal Bank of Canada,Full-Time,"Sql, Tableau, Excel, Gap, Snowflake, Teradata",In-Person,Finance,Senior,Vancouver,BC,74080.0,107987.0
Senior Business Analyst - Supply Chain Optimization,AI Analyst,Vancouver Fraser Port Authority,Full-Time,"Excel, Jira",In-Person,Technology,Senior,Vancouver,BC,84552.0,85603.0
Loyalty Campaign & Offer Analyst,AI Analyst,Parkland Corporation,Full-Time,"Database, Tableau, Power BI, Sql, Excel, Python",In-Person,Technology,ANY,Calgary,AB,53314.0,83405.0
Pricing & Legal Project Management Analyst,Others Analyst,Gowling WLG,Full-Time,"Power Bi, Excel, Database, Sql",In-Person,Others,ANY,Toronto,ON,54000.0,75000.0
Claims Compliance Analyst -,AI Analyst,Allstate,Full-Time,"Tableau, Excel",Remote,Government,ANY,South Dundas,ON,96313.0,123968.0
Pricing & Legal Project Management Analyst,Others Analyst,Gowling WLG,Full-Time,"Power Bi, Excel, Database, Sql",In-Person,Others,ANY,Hamilton,ON,54000.0,75000.0
Business Analyst 7735-0214,Business Analyst,Foilcon,Full-Time,"Sql, Gap, Power BI",In-Person,Others,ANY,Toronto,ON,69170.0,100944.0
Pricing & Legal Project Management Analyst,Others Analyst,Gowling WLG,Full-Time,"Power Bi, Excel, Database, Sql",In-Person,Others,ANY,Ottawa,ON,54000.0,75000.0
Senior Business Intelligence Engineer (Gcs),Data Engineer,Royal Bank of Canada,Full-Time,"Python, Sql, Tableau, Jira, Html, Github, Powershell, Javascript",In-Person,Finance,Senior,Toronto,ON,112313.0,130266.0
Pricing & Legal Project Management Analyst,Others Analyst,Gowling WLG,Full-Time,"Power Bi, Excel, Database, Sql",In-Person,Others,ANY,Waterloo,ON,54000.0,75000.0
Pricing & Legal Project Management Analyst,Others Analyst,Gowling WLG,Full-Time,"Power Bi, Excel, Database, Sql",In-Person,Others,ANY,Calgary,AB,54000.0,75000.0
Senior Actuarial Analyst,Others Analyst,Northbridge Financial Corporation,Full-Time,C,In-Person,Technology,Senior,Toronto,ON,68555.0,108545.0
