Job Title,Position,Company,Job Type,Skill,Work Type,Industry Type,Seniority,City,Province,Min Salary,Max Salary
"Dental Investigative Analyst, Fraud Risk Management",Risk Analyst,Sun Life,Full-Time,"Tableau, Html, Excel",In-Person,Insurance,ANY,Toronto,ON,43200.0,70800.0
Business Systems Analyst,Systems Analyst,Accenture,Full-Time,"Jira, Excel, Database, Confluence",In-Person,Others,ANY,Toronto,ON,53691.0,99893.0
"Analyst, Data Management - Trans-Canada Capital",IT Analyst,Air Canada,Full-Time,"C#, Sql, Eagle",In-Person,Others,ANY,Montréal,QC,49224.0,97465.0
Business Analyst,Business Analyst,Infosys,Full-Time,"Tableau, Power BI, Sql, Excel, Jira",In-Person,Others,ANY,Markham,ON,103042.0,107015.0
Database Analyst,Database Analyst,INNTECH FUTURE INC.,Full-Time,"Database, Sql, Mysql, Oracle Database, Python, R",In-Person,Technology,ANY,Beaumont,AB,87360.0,92394.0
Business Data Analyst,Data Analyst,Altec Global Capital Inc.,Full-Time,"C#, Python, Java",In-Person,Technology,ANY,North York,ON,93600.0,107595.0
Murex Analyst,Others Analyst,Tekshapers Inc,Full-Time,"Python, Sql",In-Person,Technology,ANY,Mississauga,ON,93600.0,94499.0
Intermediate Analyst,Others Analyst,WestJet,Full-Time,"Miro, Azure, Powershell",Remote,Others,Mid,Remote,Undef,64304.0,94478.0
Systems Analyst,Systems Analyst,WA Health,Full-Time,"Excel, Sql",In-Person,Healthcare,ANY,Hamilton,ON,60000.0,80000.0
Business Analyst,Business Analyst,University of Alberta,Full-Time,Undef,In-Person,Education,ANY,Edmonton,AB,64618.0,90053.0
Business Analyst Ll,Business Analyst,Portage Mutual Insurance,Full-Time,"Sql, Jira",In-Person,Insurance,ANY,Portage la Prairie,MB,56968.0,106211.0
Data Analyst,Data Analyst,Birchwood,Full-Time,"Database, Tableau, Mysql, Excel, SQL, Power Bi, Postgresql",In-Person,Others,ANY,Winnipeg,MB,91955.0,94108.0
Performance Media Analyst,Others Analyst,Dentsu Media,Full-Time,Excel,In-Person,Others,ANY,Toronto,ON,45000.0,60000.0
Senior Business Insights Analyst,Business Analyst,TD Bank,Full-Time,"Tableau, Machine Learning, Sql, Big Data, Excel, Bitbucket, Azure, Hadoop, Python, Jupyter",In-Person,Finance,Senior,Toronto,ON,87820.0,159068.0
Database Analyst,Database Analyst,NRIT Consulting,Full-Time,Database,In-Person,Technology,ANY,Calgary,AB,89440.0,98434.0
Database Analyst,Database Analyst,Rish Consulting,Full-Time,Database,In-Person,Consulting,ANY,Calgary,AB,89440.0,133882.0
Business Systems Analyst,Systems Analyst,Tenaquip Limitee,Full-Time,"Tableau, Sql, Database",Remote,Others,ANY,Senneville,QC,48794.0,94791.0
Pension Data Integrity Analyst,IT Analyst,Financial Services Regulatory Authority of Ontario...,Full-Time,"Database, Excel",In-Person,Service,ANY,Toronto,ON,51853.0,65946.0
Business Analyst,Business Analyst,Cargojet Airways LTD.,Full-Time,"Power Bi, Excel",In-Person,Others,ANY,Mississauga,ON,40109.0,109528.0
"Analyst, Data Integrity",IT Analyst,Allied,Full-Time,"Power Bi, Excel",In-Person,Others,ANY,Toronto,ON,80325.0,92901.0
"Senior Analyst, Franchise Acceptance Performance",Others Analyst,Mastercard,Full-Time,"Power Bi, Tableau, Excel, Sql",In-Person,Others,Senior,Toronto,ON,95083.0,108659.0
Analyst/Administrative Assistant,Others Analyst,Vancouver Coastal Health,Full-Time,"Excel, Database",In-Person,Healthcare,ANY,Vancouver,BC,60964.0,80017.0
Business Systems Analyst,Systems Analyst,TransLink,Full-Time,"C#, Azure, Sql",In-Person,Others,ANY,Metro Vancouver Regional District,BC,95724.0,115116.0
"Analyst, Flight Data",Others Analyst,Air Transat,Full-Time,"C#, Excel, Database",In-Person,Others,ANY,Dorval,QC,61598.0,79699.0
Senior Business Analyst,Business Analyst,eHealth Saskatchewan,Full-Time,Database,Remote,Healthcare,Senior,Remote,Undef,88171.0,107290.0
Geographic Information Systems (Gis) Analyst,Systems Analyst,Corporation of the City of Thunder Bay,Full-Time,Excel,In-Person,Technology,ANY,Thunder Bay,ON,79786.0,93866.0
Business System Analyst - Data Engineer,Systems Analyst,AstraNorth,Full-Time,Sql,In-Person,Others,ANY,Toronto,ON,57271.0,69047.0
Business Data Analyst,Data Analyst,Edgerise Consulting INC.,Full-Time,Undef,In-Person,Technology,ANY,Kitchener,ON,83200.0,93600.0
Senior Pricing Model Analyst,Model Analyst,Aviva,Full-Time,"C#, Python",In-Person,Others,Senior,Markham,ON,48306.0,153713.0
Information Technology - Business Intelligence Analyst,Business Analyst,Organigram INC,Full-Time,"Power Bi, Tableau, Qlikview, Machine Learning, Sql, Azure, Database",In-Person,Technology,ANY,Toronto,ON,61834.0,92881.0
Business Intelligence Analyst,Business Analyst,GLENTEL,Full-Time,"Sql, Power Bi, Power BI, Excel, Python, R",In-Person,Others,ANY,Burnaby,BC,60000.0,70000.0
"Analyst, Database",Database Analyst,Aarorn Technologies Inc.,Full-Time,"Sql, Database, Mysql, Shell, Java, Python, Javascript, Database",In-Person,Technology,ANY,Guelph,ON,87360.0,111586.0
Bi/Etl Developer,Developer,Johnston Group,Full-Time,"Sql, Python, Database, Git, Excel, Power Bi",In-Person,Others,ANY,Winnipeg,MB,64927.0,66800.0
Power Bi Report Developer 7692-3015,Developer,Foilcon,Full-Time,"Power Platform, Power Bi, Python, Database",In-Person,Others,ANY,Toronto,ON,63290.0,91297.0
Freight Analyst,Others Analyst,Nature Fresh Farms Inc,Full-Time,Undef,In-Person,Technology,ANY,Leamington,ON,73867.0,89334.0
Director Business Intelligence,Business Analyst,Canada Life Assurance Company,Full-Time,Excel,In-Person,Insurance,ANY,London,ON,89800.0,166300.0
"Business Strategy, Decision Support And Fiscal Planning Analyst",Strategy Analyst,Ministry of Education,Full-Time,Database,In-Person,Education,ANY,Toronto,ON,71563.0,100052.0
"Market Research Analyst (Full Time) Windsor, On",Research Analyst,Big Time Tickets Inc,Full-Time,Excel,In-Person,Technology,ANY,Toronto,ON,100000.0,110000.0
Data & Insights Analyst/Analyste De Données Et Perspectives,Others Analyst,World Anti-Doping Agency,Full-Time,"Tableau, Sql, Power Bi, Python, R",In-Person,Agency,ANY,Montréal,QC,55907.0,67843.0
Senior Marketing Science Analyst,Others Analyst,Knix,Full-Time,"Python, Sql, Excel, R",In-Person,Others,Senior,Toronto,ON,44798.0,72304.0
Risk & Payments Data Analyst/Analyste De Données Risques & Paiements,Data Analyst,Plusgrade,Full-Time,"Excel, Tableau, Sql, Alteryx, Python, Github, Snowflake, Database",In-Person,Others,ANY,Toronto,ON,57913.0,61517.0
"Dental Investigative Analyst, Fraud Risk Management",Risk Analyst,Sun Life,Full-Time,"Tableau, Html, Excel",In-Person,Insurance,ANY,Waterloo,ON,43200.0,70800.0
"Market Research Analyst (Full Time) Windsor, On",Research Analyst,Big Time Tickets Inc,Full-Time,Excel,In-Person,Technology,ANY,Hamilton,ON,100000.0,110000.0
Credit Analyst - Business Banking,IT Analyst,BMO Financial Group,Full-Time,Undef,In-Person,Finance,ANY,Montréal,QC,54500.0,101500.0
Business Systems Analyst,Systems Analyst,Moerai Soultions,Full-Time,"Excel, Lucidchart",In-Person,Others,ANY,Mississauga,ON,60325.0,137237.0
"Strategy Analyst, People & Culture",Strategy Analyst,ATB Financial,Full-Time,C,In-Person,Finance,ANY,Calgary,AB,61102.0,70161.0
Gis Analyst,Others Analyst,County of Grande Prairie No. 1,Full-Time,"Python, Sql",In-Person,Others,ANY,Clairmont,AB,94515.0,111196.0
"Dental Investigative Analyst, Fraud Risk Management",Risk Analyst,Sun Life,Full-Time,"Tableau, Html, Excel",In-Person,Insurance,ANY,Montréal,QC,43200.0,70800.0
Quality Assurance Analyst,IT Analyst,Mimigo Canada,Full-Time,"Python, Gitlab, Sql",In-Person,Others,ANY,Markham,ON,84210.0,97399.0
Business Analyst,Business Analyst,Windsor Essex Community Housing Corporation,Full-Time,"Sql, Power BI, Excel, Power Bi",In-Person,Technology,ANY,Windsor,ON,57200.0,78000.0
Digital Optimization Analyst,IT Analyst,Athabasca University,Full-Time,"Tableau, Power BI, Looker",Remote,Education,ANY,Athabasca,AB,67450.0,97437.0
Grid Operations Advisor (Business Analyst) | Ontario,Business Analyst,The Mosaic Company,Full-Time,Excel,In-Person,Others,ANY,Barrie,ON,91674.0,104047.0
Senior Strategic Business Analyst,Business Analyst,Alberta Pensions Services Corporation (APS),Full-Time,Reason,In-Person,Service,Senior,Edmonton,AB,77335.0,113793.0
Senior Business Analyst (Halifax),Business Analyst,Mariner Innovations,Full-Time,Gap,In-Person,Others,Senior,Halifax,NS,77847.0,82158.0
Business Analyst,Business Analyst,Infosys,Full-Time,"Tableau, Power BI, Sql, Excel, Jira",In-Person,Others,ANY,Calgary,AB,92701.0,107185.0
Facility Asset Management Data Analyst,Data Analyst,City of Edmonton,Full-Time,Excel,In-Person,Government,ANY,Edmonton,AB,85633.0,106995.0
Quality Assurance Analyst,IT Analyst,Bombardier,Full-Time,Excel,In-Person,Others,ANY,Dorval,QC,70249.0,170145.0
Business Intelligence Analyst - Information Technology (It),IT Analyst,Speerville Flour Mill Inc,Full-Time,"Tableau, Sql, Power Bi, Python, R",In-Person,Technology,ANY,Speerville,NB,51332.0,109672.0
It (Information Technology) Business Analyst,IT Analyst,ACCELARIS GROUP INC,Full-Time,Undef,In-Person,Technology,ANY,Mississauga,ON,91520.0,141728.0
"Analyst, Quality Assurance",IT Analyst,Government of Alberta,Full-Time,Scss,In-Person,Government,ANY,Edmonton,AB,61208.0,80291.0
Business Systems Analyst,Systems Analyst,MGK INFO TECH INC,Full-Time,Undef,In-Person,Technology,ANY,Hamilton,ON,95680.0,101191.0
Temporary Senior Analyst - Gis Planning - Jws (35 Hrs),Others Analyst,Halton District School Board,Full-Time,"C#, Excel, R, Database",In-Person,Education,Senior,Burlington,ON,12480.0,103064.0
"Analyst/Administrative Assistant, Clinical Informatics",Others Analyst,Vancouver Coastal Health,Full-Time,"Excel, Database",In-Person,Healthcare,ANY,Vancouver,BC,60964.0,80017.0
Pricing Analyst,Others Analyst,Alliance Door Products,Full-Time,Excel,In-Person,Others,ANY,Edmonton,AB,73957.0,80384.0
Lmr System Performance Analyst,Systems Analyst,Government of Alberta,Full-Time,"Database, Sybase, SQL, Sql",In-Person,Government,ANY,St. Albert,AB,59713.0,89212.0
Reforestation Standard Analyst,Others Analyst,Government of Alberta,Full-Time,"Excel, R",In-Person,Government,ANY,Edmonton,AB,68049.0,87547.0
Workday Consultant & Analyst,Data Consultant,EllisDon Corporation,Full-Time,"C#, Excel",In-Person,Technology,ANY,Mississauga,ON,65175.0,69261.0
Sr. Business Analyst,Business Analyst,Transatlantic Business Consulting Inc.,Full-Time,Undef,In-Person,Technology,Senior,Ottawa,ON,166400.0,208000.0
"Senior Data System Analyst ( Snowflake, Hadoop, Etl , Informatica)",Systems Analyst,Atlantis IT group,Full-Time,"Hadoop, Informatica, Snowflake, Postgresql, Aws, Sql, Qliksense, Scala, Big Data, Shell, Sas, Teradata, Python",In-Person,Technology,Senior,Markham,ON,49703.0,71049.0
Sr Portfolio Analyst,Others Analyst,Rogers Communications,Full-Time,"Power BI, Jira, Excel",In-Person,Media,Senior,Brampton,ON,89468.0,108027.0
"Analyst Senior, Strategy & Business Development",Strategy Analyst,Bombardier,Full-Time,Undef,In-Person,Others,Senior,Dorval,QC,65534.0,151050.0
"Senior Analyst, Credit Risk - Digital Banking",IT Analyst,Questrade Financial Group,Full-Time,"Power Bi, Sql, Python, Machine Learning, Sas",In-Person,Finance,Senior,Toronto,ON,84745.0,87049.0
Pricing Analyst,Others Analyst,Alliance Door Products,Full-Time,Excel,In-Person,Others,ANY,St. Thomas,ON,42798.0,117576.0
Investor Relations Analyst,Others Analyst,Clairvest,Full-Time,"Power BI, Excel",In-Person,Others,ANY,Toronto,ON,40935.0,61069.0
Business Analyst,Business Analyst,Softline Technology,Full-Time,Database,In-Person,Technology,ANY,Toronto,ON,78897.0,83556.0
Business Technology Analyst,Business Analyst,Dawson Group,Full-Time,"Tableau, Power Platform, Excel, Power Bi, C#, Python, Javascript",In-Person,Others,ANY,Kamloops,BC,65000.0,78000.0
"Senior Business Analyst, Technology Architecture",IT Analyst,CIBC,Full-Time,Undef,In-Person,Others,Senior,Toronto,ON,71376.0,92530.0
"Business Analyst, Commercial Services (Commercial Banking Analyst)",Business Analyst,FirstOntario Credit Union,Full-Time,Undef,In-Person,Media,ANY,St. Catharines,ON,41534.0,102413.0
Engagement And Research Analyst,Research Analyst,City of Calgary,Full-Time,Excel,In-Person,Government,ANY,Calgary,AB,85862.0,114774.0
Software Engineer Ii - Speech Analyst,Data Engineer,TD Bank,Full-Time,"Jira, Confluence, Machine Learning",In-Person,Finance,ANY,West,ON,110483.0,128715.0
Senior Business Analyst,Business Analyst,MUFG Investor Services,Full-Time,Excel,In-Person,Service,Senior,Halifax,NS,74028.0,145304.0
Client Support Analyst,Others Analyst,Edgecom Energy,Full-Time,Undef,In-Person,Energy,ANY,North York,ON,55000.0,58000.0
Credit Analyst - Business Banking,IT Analyst,BMO Financial Group,Full-Time,Undef,In-Person,Finance,ANY,Laval,QC,54500.0,101500.0
Sr. Business Analyst – Liquidity Reporting,IT Analyst,CGI,Full-Time,Undef,In-Person,Others,Senior,Toronto,ON,63507.0,87374.0
Institutional Analyst,IT Analyst,Royal Bank of Canada,Full-Time,Excel,In-Person,Finance,ANY,Vancouver,BC,80000.0,116451.0
"Senior Analyst, Clinical Administrative Databases",Database Analyst,Canadian Institute for Health Information,Full-Time,"Sas, Python, R, Database, Excel",In-Person,Healthcare,Senior,Ottawa,ON,42121.0,122692.0
Senior Business Analyst,Business Analyst,MUFG Investor Services,Full-Time,Excel,In-Person,Service,Senior,Toronto,ON,89864.0,102403.0
Market Research Analyst,Research Analyst,Oppein Cabinetry,Full-Time,Undef,In-Person,Others,ANY,Etobicoke,ON,96928.0,147305.0
Business Analyst 0149-3010,Business Analyst,Foilcon,Full-Time,"Azure, Gap",In-Person,Others,ANY,Toronto,ON,58892.0,77943.0
Logistics Analyst,Logistic Analyst,Chemtrade,Full-Time,Excel,In-Person,Others,ANY,Toronto,ON,59000.0,70000.0
"Analyst, Supply Chain Replenishment",AI Analyst,Loblaw Companies Limited,Full-Time,Excel,In-Person,Others,ANY,Toronto,ON,49902.0,100638.0
Research Analyst Student (Ras-0724-T),Research Analyst,New Path Youth and Family Services,Full-Time,"Power BI, Spss, Database, Excel",In-Person,Service,ANY,Barrie,ON,41620.0,46841.0
"Senior Analyst, Global Compliance & Aml Reporting",Others Analyst,Scotiabank,Full-Time,"Power BI, Excel",In-Person,Finance,Senior,Toronto,ON,39929.0,43086.0
Hse Analyst,Others Analyst,Western Energy Services,Full-Time,"Excel, Database, Eagle",In-Person,Service,ANY,Calgary,AB,78191.0,123036.0
Benefits Hr Analyst,IT Analyst,City of Brampton,Full-Time,Undef,In-Person,Government,ANY,Brampton,ON,86091.0,107614.0
"Business Analyst, Budget & Internal Reporting",Business Analyst,MEG Energy,Part-Time,Excel,In-Person,Energy,Junior,Calgary,AB,88812.0,108163.0
Business Intelligence Analyst - Information Technology (It),IT Analyst,Speerville Flour Mill Inc,Full-Time,"Sql, Big Data, Machine Learning, Javascript",In-Person,Technology,ANY,Speerville,NB,52000.0,62400.0
Analyste Spécialisé En Informatique - Cybersécurité/ Specialized Data Analyst,Data Analyst,Ungava Tulattavik Health Center,Full-Time,Notion,In-Person,Healthcare,ANY,Quebec City,QC,71800.0,78580.0
Senior Pricing Analyst,Others Analyst,LifeWorks,Full-Time,Undef,In-Person,Insurance,Senior,Toronto,ON,44665.0,80535.0
Pipe Integrity Analyst (Daytime Support),IT Analyst,DarkVision,Full-Time,Undef,In-Person,Others,ANY,Vancouver,BC,62400.0,79040.0
Work Integrated Learning Systems Analyst,Systems Analyst,SAIT,Full-Time,"Tableau, Power BI, Sql, Database",In-Person,Technology,ANY,Calgary,AB,70000.0,82000.0
Senior Front Office Business Analyst With Metals Trading Background,IT Analyst,Exadel Inc,Full-Time,Undef,In-Person,Technology,Senior,Toronto,ON,88470.0,98976.0
Sap Master Data Analyst,Data Analyst,Riverside Natural Foods Ltd.,Full-Time,Gap,In-Person,Others,ANY,Toronto,ON,112861.0,133003.0
Pay And Benefits Analyst,IT Analyst,BC Assessment,Full-Time,Undef,In-Person,Others,ANY,Victoria,BC,65466.0,76927.0
Senior Analyst - Superior Gas Liquids,Others Analyst,Superior Propane Careers,Full-Time,"Power Bi, Excel, Sql, Excel",In-Person,Others,Senior,Calgary,AB,85712.0,133996.0
Business Analyst Staff,Business Analyst,NORSAT INTERNATIONAL INC,Full-Time,"Power Bi, Excel, Sql, Database",In-Person,Technology,ANY,Richmond,BC,38000.0,48000.0
S - Senior It Business Analyst (Vancouver),IT Analyst,Lantic Inc.,Full-Time,"Tableau, Power BI",In-Person,Technology,Senior,Vancouver,BC,106945.0,114368.0
Analyst Operational Assessments Mti,Others Analyst,Independent Electricity System Operator (IESO),Full-Time,Database,In-Person,Government,ANY,Mississauga,ON,112490.0,119248.0
Capital Planning Analyst (Contract),IT Analyst,BGIS,Part-Time,Fabric,In-Person,Others,ANY,Markham,ON,91616.0,93633.0
Accounting Analyst (Transportation),Others Analyst,Pival,Full-Time,Excel,In-Person,Others,ANY,Kirkland,QC,83325.0,92618.0
Systems Analyst Ii,Systems Analyst,University of British Columbia,Full-Time,"Azure, Database, Html, Crystal, Php, Mysql, SQL, Puppet, Powershell, Java, Asp, Javascript",In-Person,Education,ANY,Vancouver,BC,99660.0,155427.0
Senior Continuous Improvement Analyst (People And Culture) (Telework/Hybrid),Others Analyst,CBC/Radio-Canada,Full-Time,Undef,Remote,Others,Senior,Ottawa,ON,67914.0,81584.0
"Analyst, Cloud Cost Management-Hybrid",Others Analyst,Alberta Energy Regulator,Full-Time,"Azure, Power BI, Database",Hybrid,Energy,ANY,Calgary,AB,74242.0,92803.0
Business Analyst 7746-0215,Business Analyst,Foilcon,Full-Time,Database,In-Person,Others,ANY,Toronto,ON,72536.0,132694.0
Senior It Business Analyst,IT Analyst,Spark Power,Full-Time,Oracle Cloud,In-Person,Energy,Senior,Oakville,ON,59432.0,103925.0
M365 Development & Collaboration Solutions Business Analyst [Oneit],IT Analyst,WSP,Full-Time,"Power Bi, Excel",In-Person,Others,ANY,Montréal,QC,76309.0,79203.0
Wellbeing And Rewards Analyst,Others Analyst,Securian Canada,Full-Time,"Smartsheet, Excel",In-Person,Others,ANY,Toronto,ON,90133.0,112969.0
Business Systems Analyst - Systems Trainer,Systems Analyst,PCL Construction,Full-Time,Undef,In-Person,Construction,ANY,Edmonton,AB,76461.0,84761.0
Planning Analyst And Performance Executive,Others Analyst,OSL Retail Services Inc,Full-Time,Excel,In-Person,Service,ANY,Montréal,QC,95000.0,105000.0
Business Systems Analyst,Systems Analyst,Blend Technologies Ltd.,Full-Time,C,In-Person,Technology,ANY,Calgary,AB,98176.0,111309.0
Systems Reliability Analyst (Sra),Systems Analyst,Scotiabank,Full-Time,"Power Bi, Big Data, Excel",In-Person,Finance,Senior,Toronto,ON,88983.0,99052.0
Sap S4/Hana Master Data Analyst (12-Month Contract),Data Analyst,Riverside Natural Foods Ltd.,Part-Time,Gap,In-Person,Others,ANY,Toronto,ON,70683.0,75165.0
Risk & Payments Data Analyst/Analyste De Données Risques & Paiements,Data Analyst,Plusgrade,Full-Time,"Excel, Tableau, Sql, Alteryx, Python, Github, C#, Snowflake, Database",In-Person,Others,ANY,Montréal,QC,62704.0,118172.0
"Senior Business Systems Analyst, Gft",Systems Analyst,Royal Bank of Canada,Full-Time,"Sql, Database, Excel",In-Person,Finance,Senior,Toronto,ON,49191.0,106349.0
Program Admin Officer 4 (Senior Analyst),Others Analyst,Province of Nova Scotia,Full-Time,Undef,In-Person,Technology,Senior,Halifax,NS,74571.0,87583.0
Supply Chain Replenishment Analyst,AI Analyst,Specialty Health Network Inc.,Full-Time,Excel,In-Person,Healthcare,ANY,Mississauga,ON,90300.0,104198.0
Business Systems Analyst (Enterprise Applications),Systems Analyst,City of London,Full-Time,"Html, Css, Power BI, Ssrs",In-Person,Government,ANY,London,ON,58649.0,85218.0
Scrum Master Bi,Others Analyst,Business Development Bank of Canada,Full-Time,Azure,In-Person,Finance,ANY,Montréal,QC,68217.0,142364.0
Mainframe Business Systems Analyst,Systems Analyst,TV2 Consulting,Full-Time,Sas,In-Person,Consulting,ANY,Saint John,NB,55580.0,56247.0
"Senior Business Systems Analyst, Gft",Systems Analyst,Royal Bank of Canada,Full-Time,"Sql, Big Data, Excel, Hadoop, Python, Jupyter",In-Person,Finance,Senior,Halifax,NS,68313.0,131940.0
Business Process Analyst - Dc & Ai,AI Analyst,AltaLink,Full-Time,"C#, Excel, Azure, Database",In-Person,Others,ANY,Calgary,AB,71000.0,94000.0
Intelligent Automation Analyst - Mandatory Bilingual. Must Speak French,Others Analyst,GoAutomate,Full-Time,"Javascript, Javascript",In-Person,Others,ANY,Etobicoke,ON,35000.0,84000.0
Trade Marketing Analyst,Others Analyst,Nature Fresh Farms Inc,Full-Time,Excel,In-Person,Technology,ANY,Leamington,ON,80601.0,145178.0
Cost Accounting Analyst,Others Analyst,Weir Group,Full-Time,Excel,In-Person,Others,ANY,Surrey,BC,90000.0,100000.0
Physician Compensation Analyst,Others Analyst,Interior Health Authority,Full-Time,Undef,In-Person,Healthcare,ANY,Kelowna,BC,79601.0,109470.0
"It Senior Business Analyst, Scheduling & Distribution (T & I) (Hybrid)",IT Analyst,CBC/Radio-Canada,Full-Time,Jira,Hybrid,Others,Senior,Montréal,QC,76510.0,95776.0
Energy Systems Operation Analyst,Systems Analyst,Renteknik Group Inc.,Full-Time,"Excel, C",In-Person,Technology,ANY,Burlington,ON,66664.0,85615.0
"Bilingual Policy Analyst, Early Learning And Elementary-Secondary Education",Policy Analyst,"CMEC Council Of Ministers of Education, Canada",Full-Time,Undef,In-Person,Education,ANY,Toronto,ON,64513.0,90181.0
Payroll Analyst,Payroll Analyst,Peterborough Regional Health Centre,Full-Time,"Excel, Excel",In-Person,Healthcare,ANY,Peterborough,ON,78478.0,98092.0
Analyste Multidisciplinaire En Mécanique / Multi-Disciplinary Mechanical Analyst,AI Analyst,Pratt & Whitney,Full-Time,"C#, Matlab, Assembly",In-Person,Others,ANY,Longueuil,QC,61306.0,99665.0
Commercial Analyst,Others Analyst,Ebury,Full-Time,Excel,In-Person,Others,ANY,Toronto,ON,60393.0,116877.0
"Sr Analyst, Actuarial- Personal Insurance Pricing",Others Analyst,Definity Financial Corporation,Full-Time,"Sas, Vba, Excel, Database",In-Person,Technology,Senior,Waterloo,ON,69800.0,140400.0
Business Systems Analyst,Systems Analyst,Web Infomatic Services Ltd,Full-Time,C,In-Person,Service,ANY,Calgary,AB,98176.0,127468.0
Accounts Receivable Analyst,Others Analyst,Niche Bakers Corp,Full-Time,Excel,In-Person,Others,ANY,Etobicoke,ON,52188.0,133788.0
Trade Marketing Analyst,Others Analyst,Reckitt,Full-Time,Undef,In-Person,Others,ANY,Toronto,ON,60668.0,93323.0
Senior Servicing Analyst,Others Analyst,BMO Financial Group,Full-Time,Undef,In-Person,Finance,Senior,Montréal,QC,44500.0,82500.0
Développeur-Analyste Power Bi,Others Analyst,Airmedic,Full-Time,"Power Bi, Sql, Azure, Power BI, Ssis, Sqlserver, .Net",In-Person,Healthcare,ANY,Longueuil,QC,133217.0,153454.0
Registered Behaviour Analyst (Rba),Others Analyst,Barrantes & Associates Inc.,Full-Time,Undef,In-Person,Technology,ANY,Guelph,ON,70000.0,75000.0
"Compensation Consulting Analyst - People Advisory Services, Rewards - Toronto",Others Analyst,EY,Full-Time,Excel,In-Person,Others,ANY,Toronto,ON,33008.0,106772.0
Logistic & Distribution Analyst,Logistic Analyst,CCM Hockey,Full-Time,Undef,In-Person,Others,ANY,Montréal,QC,75908.0,110105.0
"Operations Analyst, Business Lending - 2 Year Term Opportunity",IT Analyst,ATB Financial,Full-Time,Jira,In-Person,Finance,ANY,Calgary,AB,65019.0,129026.0
Logistic & Distribution Analyst,Logistic Analyst,CCM Hockey,Full-Time,Undef,In-Person,Others,ANY,Saint-Jean-sur-Richelieu,QC,56877.0,80611.0
"Actuarial Analyst, Commercial Insurance - Pricing",Others Analyst,Definity Financial Corporation,Full-Time,"Excel, Sas, Vba, C#, Python, R",In-Person,Technology,ANY,Toronto,ON,52300.0,103300.0
Business System Analyst - Sap Fico,Systems Analyst,Riverside Natural Foods Ltd.,Full-Time,Gap,In-Person,Others,ANY,Toronto,ON,101553.0,115774.0
Senior Tax Analyst,Others Analyst,North American Construction Group Inc.,Full-Time,Excel,In-Person,Technology,Senior,Acheson,AB,53837.0,125655.0
"Intermediate Actuarial Analyst, Commercial Insurance Pricing",Others Analyst,Definity Financial Corporation,Full-Time,"Excel, Sas, Vba, C#, Python, R",In-Person,Technology,Mid,Toronto,ON,59400.0,118100.0
Business Analyst Position (Remote),IT Analyst,Saint Laurent Consulting,Full-Time,"Power Bi, Excel",Remote,Consulting,ANY,Remote,Undef,87776.0,92956.0
"Associate Pm/Business Analyst (Open To North, Central, And South America)",Business Analyst,Function Health,Full-Time,"Sql, Python, Tableau, Swift, Machine Learning, Aws, Confluence, Excel, Gap, Power Bi, Jira",Remote,Healthcare,Mid,Remote,Undef,94100.0,107728.0
Information And Data Management Advisor/Analyst/Officer,Others Analyst,CNSC/CCSN,Full-Time,Undef,In-Person,Others,ANY,Ottawa,ON,89978.0,93912.0
Data Analyst,Data Analyst,Cabela's,Full-Time,"Sql, Power Bi, Python, Visual Basic, Excel, Google Cloud Platform",In-Person,Others,ANY,Winnipeg,MB,58000.0,116564.0
Data Analyst,Data Analyst,Value Partners Investments,Full-Time,"Power Bi, Fabric, Tableau, Sql, Gap, Python, R",In-Person,Finance,ANY,Winnipeg,MB,106763.0,145339.0
"Analyst, Business Intelligence",Business Analyst,Vancouver Whitecaps FC,Full-Time,"Sql, Tableau, Power BI, Excel",In-Person,Technology,ANY,Vancouver,BC,70000.0,80000.0
Senior Data Analyst,Data Analyst,Canadian Tire Corporation,Full-Time,"Aws, Sql, Big Data, Snowflake, Hadoop, Azure, Python",In-Person,Technology,Senior,Oakville,ON,82654.0,86756.0
"Specialist, Business Intelligence Data Warehouse",Business Analyst,Island Health,Full-Time,"Database, Sql",In-Person,Healthcare,Senior,Victoria,BC,94931.0,136448.0
Business Analyst,Business Analyst,The Minto Group,Full-Time,"Power Bi, Excel, Sql",In-Person,Others,ANY,Ottawa,ON,69631.0,137670.0
"Senior Data Analyst, Pricing And Finance",Data Analyst,ServiceTitan,Full-Time,"Tableau, Sql, Big Data, Excel, Apache Airflow",Remote,Service,Senior,Remote,Undef,20000.0,154000.0
Business Data Analyst,Data Analyst,Scotiabank,Full-Time,"Big Data, Sql, Excel, Gap, Big Data",In-Person,Finance,ANY,Toronto,ON,75237.0,97031.0
Senior Business Data Analyst,Data Analyst,Ontario Securities Commission,Full-Time,"Tableau, Crystal, Sql, Gap, Python, R",In-Person,Others,Senior,Toronto,ON,95888.0,151824.0
Business Analyst,Business Analyst,Porter Airlines Inc.,Full-Time,Excel,In-Person,Technology,ANY,Toronto,ON,100997.0,123108.0
Data Analyst - Informatics And Systems,Data Analyst,Systematic Squad Inc.,Full-Time,Database,In-Person,Technology,ANY,Calgary,AB,62400.0,92688.0
