Job Title,Position,Company,Job Type,Skill,Work Type,Industry Type,Seniority,City,Province,Min Salary,Max Salary
"Senior Business Analyst, It",IT Analyst,Canaccord Genuity Corp.,Full-Time,"Jira, Business analysis, Python, SQL, Data management",In-Person,Others,Senior,Montréal,QC,56164.0,75658.0
"Analyst - Performance, Wind Energy",Others Analyst,Innergex,Full-Time,"Bilingual, Tableau, MATLAB, Writing skills, Python",In-Person,Others,ANY,Longueuil,QC,98000.0,105000.0
Data Insights Analyst,Others Analyst,BAM Strategy,Full-Time,"Bilingual, Tableau, Power BI, SQL, SAS",Remote,Consulting,ANY,Remote,Undef,71255.0,73563.0
Electrical Research Engineer (Power Market Analyst And Data Scientist – Noc 21310),Data Engineer,Arcus Power Corp,Full-Time,"CI/CD, Azure, Git, Python, SQL",In-Person,Energy,ANY,Calgary,AB,110000.0,130000.0
"Senior Developer, Business Intelligence",Business Analyst,Ontario Health,Full-Time,"Tableau, Power BI, Azure, Business intelligence, SAS",In-Person,Healthcare,Senior,Toronto,ON,63613.0,107851.0
Sr. It Data Analyst,Data Analyst,TD Bank,Full-Time,"Python, No SQL, Power BI, SQL, Project management",In-Person,Finance,Senior,Toronto,ON,75000.0,108000.0
Data Analyst,Data Analyst,SnapPay,Full-Time,"R, Business analysis, Statistics, Process improvement, Visio",In-Person,Others,ANY,Mississauga,ON,46000.0,105000.0
Business Development Data Analyst - Remote Work,Data Analyst,BairesDev,Full-Time,Undef,Remote,Others,ANY,Vancouver,BC,75000.0,110000.0
Data Insight And Reporting Analyst,Others Analyst,HomeEquity Bank,Full-Time,"SQL, SQL, Presentation skills, Analytics",In-Person,Finance,ANY,Toronto,ON,65000.0,80000.0
Operations Data Analyst,Data Analyst,Arctiq,Full-Time,"Power BI, Data modeling, SQL, R, Quality management",In-Person,Others,ANY,Toronto,ON,75000.0,85000.0
Data Analyst - Informatics And Systems,Data Analyst,Snaplii,Full-Time,"Statistics, Power BI, SQL, Data mining, XML",In-Person,Others,ANY,Mississauga,ON,43000.0,93000.0
Business Intelligence Analyst (Two Positions Available),AI Analyst,Farm Credit Canada,Full-Time,"Statistics, Computer science, Python, Research, Statistics",In-Person,Others,ANY,Regina,SK,80000.0,87000.0
Bilingual Servicing Analyst,Others Analyst,BMO Financial Group,Full-Time,"Bilingual, Tableau, Filing, Python, Statistics",In-Person,Finance,ANY,Montréal,QC,38000.0,70000.0
Data Analyst & Bi Specialist,Data Analyst,UniUni (Uni Express Inc.),Full-Time,"Statistics, Business analysis, Statistics, SQL, AWS",Remote,Technology,Senior,Remote,Undef,70000.0,90000.0
Inventory Analyst,Others Analyst,"Portland Tractor, Inc.",Full-Time,"Sage, SQL, Microsoft Access, Statistics, Office Suite",In-Person,Technology,ANY,Langley,BC,60000.0,70000.0
Business Data Analyst,Data Analyst,Dawn InfoTek Inc.,Full-Time,"Computer science, Azure, Business analysis, Google Cloud Platform, AWS",In-Person,Technology,ANY,Toronto,ON,135200.0,156000.0
"Data Analyst, Business Intelligence",Data Analyst,Bell,Full-Time,"Tableau, Oracle, SAS, SQL, SQL",In-Person,Others,ANY,Toronto,ON,72000.0,86000.0
It Business Systems Analyst,Systems Analyst,Greenfire Resources Operating Corporation,Full-Time,"Oracle, Oil & gas, Business analysis, SQL, Windows",In-Person,Technology,ANY,Fort McMurray,AB,72000.0,82000.0
Part-Time Data Quality Analyst (Fraud Investigation),IT Analyst,owl.co,Full-Time,"Research, Natural language processing, Typing, No SQL",In-Person,Others,ANY,Toronto,ON,41600.0,79721.0
Sustainability Analyst,AI Analyst,KeeWee,Full-Time,"SQL, Oil & gas, Statistics, SQL, Python",Remote,Others,ANY,Remote,Undef,46101.0,75606.0
Career Re-Entry - Operations Training Reporting Analyst V,AI Analyst,Enbridge,Full-Time,"Power BI, Data structures, Oil & gas, SQL, Statistics",In-Person,Others,ANY,Edmonton,AB,56000.0,76000.0
Data Analyst,Data Analyst,KF Aerospace,Full-Time,"Power BI, Data modeling, SQL, SQL, Statistics",In-Person,Aerospace,ANY,Kelowna,BC,77000.0,96000.0
Power Bi Developer | Data Analyst,Data Analyst,Silver Gold Bull Inc.,Full-Time,"Power BI, SQL, Magento, E-commerce, SQL",In-Person,Technology,ANY,Calgary,AB,65000.0,120000.0
Reporting And Business Intelligence Analyst,Business Analyst,Radiant Canada,Full-Time,"Power BI, Data modeling, SQL, Data mining, Business intelligence",In-Person,Others,ANY,Mississauga,ON,65000.0,77000.0
Data Analyst Intern,Data Analyst,Klue,Part-Time,"SQL, Python",In-Person,Others,Junior,Vancouver,BC,44000.0,45000.0
Game Data Analyst,Data Analyst,Prodigy Education,Full-Time,"Statistics, Python, SQL, Statistics, No SQL",In-Person,Education,ANY,Midtown Toronto,ON,89000.0,111000.0
Data Analyst,Data Analyst,Birchwood,Full-Time,"Power BI, SQL, Statistics, Disaster recovery, SQL",In-Person,Others,ANY,Winnipeg,MB,52000.0,74000.0
Data Analyst,Data Analyst,Sri Technosoft Solutions,Full-Time,"Power BI, Business intelligence, Business analysis, Statistics, Tableau",In-Person,Technology,ANY,Edmonton,AB,41734.0,116796.0
Data Analyst Intern,Data Analyst,American Iron and Metal,Part-Time,"SQL, Microsoft Access, Maximo, Statistics, No SQL",In-Person,Others,Junior,Montréal,QC,62497.0,66984.0
Res O 21R - Data Analyst,Data Analyst,BC Public Service,Full-Time,"Computer science, R, SQL, Python",In-Person,Service,ANY,Burnaby,BC,70000.0,79000.0
Developer / Data Analyst,Data Analyst,AXIS Database Marketing,Full-Time,"No SQL, SQL, Microsoft Access, Visual Basic, Database development",In-Person,Others,ANY,Mississauga,ON,43000.0,93000.0
"Data Analyst, Born Ontario, Temporary Full-Time (1.0)",Data Analyst,CHEO,Full-Time,"Bilingual, Tableau, Statistical software, Computer science, SQL",In-Person,Others,ANY,Ottawa,ON,72883.0,89440.0
Data Analyst,Data Analyst,Cabela's,Full-Time,"No SQL, Power BI, SQL, Microsoft Outlook, Visual Basic",In-Person,Others,ANY,Winnipeg,MB,58000.0,182270.0
C-Ge-916 – Data Analyst,Data Analyst,CAE,Full-Time,"Power BI, Confluence, No SQL",In-Person,Others,ANY,Saint-Laurent,QC,81000.0,91000.0
Quantitative Data Analyst,Data Analyst,The Mustard Seed Society,Full-Time,"Statistics, Power BI, SQL, Microsoft Outlook, Business intelligence",In-Person,Others,ANY,Calgary,AB,60000.0,95000.0
Category Analyst,Others Analyst,Groupe Leclerc,Full-Time,"Bilingual, Tableau, Sales, Retail Link, Nielsen",In-Person,Others,ANY,Canada,Undef,97263.0,157719.0
"Business Intelligence Analyst Toronto, Canada Commercial",Business Analyst,"Rothmans, Benson & Hedges Inc",Full-Time,"Computer science, Power BI, SQL, Salesforce, Databases",In-Person,Technology,ANY,Toronto,ON,82000.0,87000.0
Procurement Data Analyst,Data Analyst,Mitsubishi Electric Sales Canada Inc.,Full-Time,"Python, Sourcing, Power BI, SQL, Procurement",In-Person,Technology,ANY,Markham,ON,48000.0,80000.0
Data Analyst And Bi Developer - Toronto (Insurance),Data Analyst,Trisura Guarantee Insurance Company,Full-Time,"Power BI, Data modeling, SSRS, Databases, Database design",In-Person,Insurance,ANY,Toronto,ON,65000.0,85000.0
Data Analyst - Product,Data Analyst,Appcast,Full-Time,"Statistics, SQL, Statistics, Tableau, SQL",In-Person,Others,ANY,Fredericton,NB,55000.0,66000.0
Business Analyst,Business Analyst,TripNinja,Full-Time,"Power BI, SQL, AWS, Statistics, Presentation skills",Remote,Others,ANY,Remote,Undef,80000.0,90000.0
Data Analyst,Data Analyst,Fraser Health,Full-Time,"Statistical software, Power BI, Visual Basic, SAS, R",In-Person,Healthcare,ANY,Surrey,BC,79289.0,113984.0
Data Analyst (Street Operations),Data Analyst,The City of Vancouver,Full-Time,"Power BI, SQL, Statistics, SQL, Statistics",In-Person,Technology,ANY,Vancouver,BC,87443.0,103272.0
"Analyst, Data Integrity",IT Analyst,Allied,Full-Time,"Tableau, Power BI, SQL, ERP systems, Yardi",In-Person,Others,ANY,Toronto,ON,70000.0,95000.0
Junior Business Support Analyst,Business Analyst,Intelligent Hospitality,Full-Time,Analytics,Remote,Others,Junior,Remote,Undef,40000.0,50000.0
Senior Data Analyst,Data Analyst,Scene+,Full-Time,"Tableau, SQL, Presentation skills, Machine learning, No SQL",In-Person,Others,Senior,Toronto,ON,43000.0,93000.0
Geophysicist/Data Analyst,Data Analyst,Sander Geophysics Limited,Full-Time,Computer skills,In-Person,Others,ANY,Ottawa,ON,74205.0,137700.0
Business Analyst Position (Remote),IT Analyst,Saint Laurent Consulting,Full-Time,"Power BI, SQL, SAP, Supply chain, Statistics",Remote,Consulting,ANY,Remote,Undef,71010.0,115063.0
Data Analyst,Data Analyst,Runnymede Healthcare Centre,Full-Time,"Microsoft Windows Server, Python, No SQL, Adobe Photoshop, SQL",In-Person,Healthcare,ANY,Toronto,ON,65000.0,75000.0
"Business Data Analyst, Retro Admin",Data Analyst,PartnerRe,Full-Time,"Tableau, Alteryx, Office Suite, SQL, Quality assurance",In-Person,Others,ANY,Toronto,ON,72652.0,79482.0
Inventory Data Analyst,Data Analyst,Leavitt Machinery Canada Inc.,Full-Time,"Power BI, SQL, ERP systems, Tableau, SQL",In-Person,Technology,ANY,Coquitlam,BC,50000.0,70000.0
Sr. Data Analyst,Data Analyst,"Railserve, Inc.",Full-Time,"Computer science, Power BI, R, Statistics, Tableau",In-Person,Technology,Senior,Edmonton,AB,85000.0,89827.0
"Business Analyst, Business Intelligence (Bi) - Belron Canada",Business Analyst,Belron Canada,Full-Time,"Bilingual, Tableau, Power BI, Azure, Business intelligence",In-Person,Others,ANY,Montréal,QC,84000.0,90000.0
Data & Systems Analyst,Systems Analyst,Aecon Group,Full-Time,"Power BI, SQL, Statistics, Data analytics, Organizational skills",In-Person,Others,ANY,Toronto,ON,69000.0,80000.0
Senior Data Analyst,Data Analyst,American Tall,Full-Time,"Pricing, Azure, R, Statistics, Google Cloud Platform",In-Person,Others,Senior,Mississauga,ON,77000.0,97000.0
Edi Data Analyst,Data Analyst,Jewish Family and Child Service,Full-Time,"Tableau, Russian, Presentation skills, Data management, Data entry",In-Person,Service,ANY,Toronto,ON,69000.0,84000.0
Project Controls Analyst,Others Analyst,Thermo Design Engineering Ltd,Full-Time,"Python, No SQL, Cost management, Power BI, Sage",In-Person,Construction,ANY,Edmonton,AB,68224.0,101517.0
Data Business Analyst,Business Analyst,"Bridgenext, Inc",Full-Time,"Power BI, SQL, Azure, Business intelligence, Office Suite",In-Person,Technology,ANY,Canada,Undef,77159.0,100530.0
Business Data Analyst,Data Analyst,Accencis Group,Full-Time,"Agile, iOS, Python, Statistics, Project management software",In-Person,Others,ANY,Richmond Hill,ON,90480.0,96633.0
Data Centre Analyst,Others Analyst,TransLink,Full-Time,"Data center experience, Enterprise architecture, Computer hardware, IT",In-Person,Others,ANY,Vancouver,BC,10000.0,73893.0
Business Development Data Analyst - Remote Work,Data Analyst,BairesDev,Full-Time,Undef,Remote,Others,ANY,Calgary,AB,60000.0,109000.0
Data Analyst,Data Analyst,University of Saskatchewan,Full-Time,"Power BI, Data modeling, SQL, Business analysis, Research",In-Person,Education,ANY,Saskatoon,SK,70000.0,115000.0
Data Analyst - Kenwave Solutions Inc.,Data Analyst,Kenaidan Contracting Ltd,Full-Time,"Statistics, MATLAB, Signal processing, SQL, Machine learning",In-Person,Others,ANY,Mississauga,ON,64000.0,80000.0
Data Analyst,Data Analyst,Canadian Nuclear Laboratories,Full-Time,"ArcGIS, SQL, SQL, Database design, Presentation skills",In-Person,Research,ANY,Port Hope,ON,55000.0,71000.0
Binance Accelerator Program - Data Analyst (Risk),Data Analyst,Binance,Full-Time,"Bilingual, Agile, Statistics, Python, SQL",Remote,Cryptocurrency Exchange,ANY,Remote,Undef,95408.0,122145.0
Data Analyst,Data Analyst,CAPREIT,Full-Time,"Jira, Power BI, SQL, Data structures, Yardi",In-Person,Technology,ANY,Toronto,ON,58294.0,61269.0
Continuous Improvement/Business Analyst,Business Analyst,FleetOptics Inc,Full-Time,"Tableau, Power BI, SQL, Logistics, Process improvement",In-Person,Technology,ANY,Mississauga,ON,60000.0,90000.0
Business Analyst/Quality Assurance Analyst,IT Analyst,DLL,Full-Time,"Jira, No SQL, SAFe, SQL, Microsoft Outlook",In-Person,Others,ANY,Burlington,ON,76000.0,114000.0
Icqa Data Analyst,Data Analyst,"Amazon Canada Fulfillment Services, ULC.",Full-Time,"SQL, Data mining, Office Suite, Project management",In-Person,Service,ANY,Cambridge,ON,49000.0,78000.0
Infrastructure Data Analyst,Data Analyst,City of Markham,Full-Time,"ArcGIS, AutoCAD, SQL, Statistics, Pivot tables",In-Person,Government,ANY,Markham,ON,77000.0,87000.0
Senior Data Analyst,Data Analyst,Clutch Technologies Inc.,Full-Time,"Pricing, Tableau, SQL, Data visualization, No SQL",In-Person,Technology,Senior,Etobicoke,ON,61000.0,100000.0
Summer/Fall Co-Op- Analyst,Others Analyst,Canadian Cannabis Exchange Ltd.,Full-Time,"Office Suite, Data analytics, Computer skills, No SQL, Time management",In-Person,Others,ANY,Calgary,AB,34611.0,49233.0
Data Analyst,Data Analyst,Value Partners Investments,Full-Time,"Power BI, R, Tableau, SQL, Scripting",In-Person,Finance,ANY,Winnipeg,MB,42000.0,69000.0
Data And Business Intelligence Analyst,Business Analyst,University of Toronto,Full-Time,"Power BI, SQL, Business intelligence, Statistics, SQL",In-Person,Education,ANY,Toronto,ON,85000.0,93000.0
Business Analyst - Hybrid,Business Analyst,CarltonOne,Full-Time,"Supply chain, Process improvement, NetSuite, Software development, Web services",Hybrid,Others,ANY,Markham,ON,70000.0,80000.0
Information Analyst - Data Quality,IT Analyst,eHealth Saskatchewan,Full-Time,"Power BI, Statistics, Office Suite, Databases, Change management",In-Person,Healthcare,ANY,Regina,SK,74152.0,90272.0
Data Analyst / Analyste De Données,Data Analyst,FlightHub,Full-Time,"Statistical software, SQL, Sales, Customer service, SQL",In-Person,Others,ANY,Montréal,QC,86063.0,91975.0
Business System Analyst -Data Engineer,Systems Analyst,Zortech Solutions,Full-Time,"Oracle, SQL, Data warehouse, Python, Hadoop",In-Person,Technology,ANY,Toronto,ON,120000.0,130000.0
Supply Chain Data Analyst,Data Analyst,City of Calgary,Full-Time,"Python, No SQL, Statistics, Computer science, Power BI",In-Person,Government,ANY,Calgary,AB,85862.0,114774.0
Data Analyst With Python And Etl,Data Analyst,Scotiabank,Full-Time,"Computer science, Elasticsearch, Kubernetes, XML, Statistics",In-Person,Finance,ANY,Toronto,ON,70000.0,93000.0
Senior System Business Analyst,Systems Analyst,Imperial Dade,Full-Time,"Bilingual, Tableau, SQL, ERP systems, Python",In-Person,Others,Senior,Saint-Laurent,QC,80000.0,98770.0
"Data System Analyst (Need -Snowflake, Hadoop, Etl) @ Markham - Hybrid - Long Term",Systems Analyst,Atlantis IT group,Full-Time,"Performance tuning, Computer science, Oracle, XML, SAS",Hybrid,Technology,ANY,Toronto,ON,56000.0,100000.0
Engineering Project Data Analyst,Data Analyst,CMC Électronique,Full-Time,"Jira, Power BI, SQL, Primavera, Tableau",In-Person,Others,ANY,Montréal,QC,69000.0,80000.0
Data Analyst,Data Analyst,ITK,Full-Time,"Tableau, Computer operation, Word processing, Statistics, Python",In-Person,Technology,ANY,Ottawa,ON,53000.0,84000.0
Business Analyst - 355 - Remote,Business Analyst,Voyageur Aviation Corp,Full-Time,"Python, No SQL, Power BI, SQL, Statistics",Remote,Transportation,ANY,North Bay,ON,70000.0,87000.0
Data Systems Analyst,Systems Analyst,Riverdale Poultry,Full-Time,"Computer operation, Power BI, SQL, R, Statistics",In-Person,Others,ANY,Kitchener,ON,35000.0,65000.0
Business Analyst ( Data Mining ),Business Analyst,Atlantis IT group,Full-Time,"Jira, Data mining, Python, Presentation skills, No SQL",In-Person,Technology,ANY,Toronto,ON,60000.0,99000.0
Business Analyst,Business Analyst,Dawn InfoTek Inc.,Full-Time,"Jira, Power BI, SQL, Office Suite, SQL",In-Person,Technology,ANY,Scarborough,ON,93600.0,114400.0
Technical Data Analyst,Data Analyst,CNOOC International,Full-Time,"ArcGIS, Power BI, SQL, R, Data management",In-Person,Others,ANY,Calgary,AB,60000.0,100000.0
Data Analyst,Data Analyst,Atlantis IT group,Full-Time,"SAP, Tableau, SQL, Statistics, Organizational skills",In-Person,Technology,ANY,Winnipeg,MB,42000.0,69000.0
Business Analyst -Pharmacy,Business Analyst,Atlantis IT group,Full-Time,"Business analysis, Statistics, No SQL",In-Person,Technology,ANY,Toronto,ON,50806.0,91265.0
Program Data Analyst,Data Analyst,Nova Scotia School Boards (NSSB),Full-Time,"No SQL, SQL, Microsoft Outlook, SAP, Filing",In-Person,Education,ANY,Berwick,NS,47000.0,58000.0
Business Analyst,Business Analyst,CBIG- Canadian Benefits Invst & Ins Grp,Full-Time,"Python, No SQL, SQL, Microsoft Outlook, Sales",In-Person,Others,ANY,Prince George,BC,50000.0,60000.0
Treasury Data Analyst,Data Analyst,GFL Environmental,Full-Time,"Crystal Reports, SQL, Microsoft Access, JD Edwards, DB2",In-Person,Environment,ANY,Vaughan,ON,70000.0,76000.0
Data Analyst - Regular Full-Time,Data Analyst,District of Squamish,Full-Time,"Computer science, Customer service, System architecture, Databases, SQL",In-Person,Others,ANY,Squamish,BC,87734.0,121997.0
Data & Insights Analyst/Analyste De Données Et Perspectives,Others Analyst,World Anti-Doping Agency,Full-Time,"Bilingual, Tableau, Statistics, Spanish, Power BI",In-Person,Agency,ANY,Montréal,QC,71633.0,116248.0
"Data Analyst, Born Ontario, Permanent Full Time (1.0) / Analyste De Données, Born Ontario - Poste À Temps Plein (1,0)",Data Analyst,CHEO,Full-Time,"Bilingual, Tableau, Statistical software, Computer science, SQL",In-Person,Others,ANY,Ottawa,ON,72883.0,89440.0
Data Quality And Management Analyst,IT Analyst,Flexiti,Full-Time,"Azure, SQL, NoSQL, Google Cloud Platform, Databases",In-Person,Others,ANY,Ontario,Undef,39566.0,185547.0
Copy Of Data Analyst And Solution Developer,Data Analyst,INLAN,Full-Time,"Databases, C++, Machine learning, Python",Remote,Others,ANY,Remote,Undef,71820.0,77722.0
Business Analyst,Business Analyst,Canadian Nuclear Laboratories,Full-Time,"Power BI, SQL, Primavera, Quality management, Office Suite",Remote,Research,ANY,Remote,Undef,66265.0,97989.0
Business Data Analyst,Data Analyst,Altec Global Capital Inc.,Full-Time,"Python, Java, Statistics, C++, C",In-Person,Technology,ANY,North York,Undef,93600.0,94780.0
Business Intelligence Analyst/Developer,Business Analyst,Progi,Full-Time,"Power BI, Cloud infrastructure, SQL, Azure, C#",Remote,Others,ANY,Remote,ON,91786.0,127097.0
Programs Data Analyst,Data Analyst,Owen Sound Family Health Team,Full-Time,"Data mining, Customer service, Statistics, Office Suite, Database management",In-Person,Healthcare,ANY,Owen Sound,ON,45344.0,49212.0
Business Intelligence Analyst,Business Analyst,Autodesk,Full-Time,"Tableau, Power BI, Data modeling, Business intelligence, D3.js",In-Person,Others,ANY,Toronto,ON,80000.0,124000.0
Signal Processing Engineer And Data Analyst,Data Analyst,INLAN,Full-Time,Databases,Remote,Others,ANY,Remote,Undef,60242.0,83279.0
It Business Analyst,IT Analyst,Roots,Full-Time,"Oracle, No SQL",In-Person,Others,ANY,Toronto,ON,58000.0,75000.0
Intermediate Data Support Analyst (6-Month Contract),Others Analyst,AGF Management Limited,Part-Time,"Investment, SQL, Relational databases, Maintenance, Bloomberg",In-Person,Others,Mid,Toronto,ON,68000.0,81000.0
Business Analyst,Business Analyst,"SupplyOne Canada, Inc.",Full-Time,"Power BI, SQL, Azure, APIs, No SQL",In-Person,Technology,ANY,Brampton,ON,60000.0,70000.0
Senior Technical Business Analyst,Business Analyst,Canadian Cancer Society,Full-Time,"No SQL, SQL, Microsoft Outlook, Salesforce, Visio",In-Person,Healthcare,Senior,Halifax,NS,61000.0,111978.0
Staff Data Analyst,Data Analyst,HelloFresh,Full-Time,"SQL, Tableau, SQL, Statistical analysis, Statistics",In-Person,Others,ANY,Toronto,ON,81000.0,110000.0
Data Analyst And Reporting Tools Developer,Data Analyst,Fidelity Investments,Full-Time,"Power BI, SQL, Microsoft Access, Business analysis, Tableau",In-Person,Finance,ANY,Toronto,ON,70000.0,100000.0
Strategic Data Analyst,Data Analyst,Element Fleet Management,Full-Time,"Cognos, Crystal Reports, Power BI, SQL, Microsoft Access",In-Person,Others,ANY,Mississauga,ON,78000.0,93000.0
Business Data Analyst,Data Analyst,Scotiabank,Full-Time,"Python, No SQL, SQL, Big data, Business analysis",In-Person,Finance,ANY,Toronto,ON,75000.0,100000.0
Data Analyst,Data Analyst,HKJ Marketing,Full-Time,"SQL, Business intelligence, R, Tableau, SQL",In-Person,Others,ANY,Vancouver,BC,53000.0,84000.0
Advanced Data Analyst - Frostbite,Data Analyst,Electronic Arts,Full-Time,"Statistics, Power BI, Azure, Google Cloud Platform, SQL",In-Person,Others,Senior,Vancouver,BC,108000.0,147000.0
Supply Chain Bi Solutions Analyst,AI Analyst,Pet Valu,Full-Time,"Cognos, Computer science, Power BI, SQL, Microsoft Outlook",In-Person,Others,ANY,Midtown Toronto,ON,52000.0,68000.0
Healthcare Research & Data Analyst- Medtech Insights,Data Analyst,Clarivate,Full-Time,"SQL, Statistics",In-Person,Others,ANY,Toronto,ON,83000.0,104000.0
Business System Analyst -Data Engineer,Systems Analyst,Esolutions,Full-Time,"Oracle, SQL, Data warehouse, Python, Hadoop",In-Person,Consulting,ANY,Toronto,ON,58006.0,137557.0
Business Analyst/Data Analyst,Data Analyst,Swiss RE,Full-Time,"Power BI, Oracle, Waterfall, Relational databases, Data structures",In-Person,Others,ANY,Toronto,ON,81000.0,114000.0
Business Analyst,Business Analyst,BMO Financial Group,Full-Time,"SQL, Statistics, Agile, Test cases, Business requirements",In-Person,Finance,ANY,Toronto,ON,60000.0,112000.0
Senior Data Analyst,Data Analyst,Electronic Arts,Full-Time,"Power BI, Big data, Tableau, SQL, A/B testing",In-Person,Others,Senior,Toronto,ON,89000.0,123000.0
Data Analyst - Informatics And Systems,Data Analyst,SULYMON GLOBAL INC.,Full-Time,"Oracle, Python, SQL, Computer skills, Python",In-Person,Technology,ANY,North York,ON,90480.0,92174.0
Oracle Erp Data Analyst – Reconciliation Specialist,Data Analyst,AstraNorth,Full-Time,"Power BI, SQL, Oracle, Supply chain, R",In-Person,Others,Senior,Brampton,ON,43000.0,93000.0
Business Data Analyst,Data Analyst,Siga Home Comfort Inc.,Full-Time,Python,In-Person,Technology,ANY,North York,ON,90001.0,145312.0
Senior Data Analyst,Data Analyst,SickKids,Full-Time,"Statistics, SAS, R, SQL, Machine learning",In-Person,Others,Senior,Toronto,ON,85000.0,90000.0
"Analyst, Data Valorization",Others Analyst,Desjardins,Full-Time,"Tableau, Statistics",In-Person,Others,ANY,Montréal,QC,80807.0,84730.0
"Analyst, Data",Others Analyst,Aecon Group,Full-Time,"Power BI, SAP, Spark, R, Primavera",In-Person,Others,ANY,Toronto,ON,58000.0,80000.0
Data Analyst (Programming Team),Data Analyst,NMG Consulting,Full-Time,"Python, Power BI, SAS, R, Research",In-Person,Consulting,ANY,Toronto,ON,45041.0,87115.0
Inside Sales Rep & Junior Business Analyst,Business Analyst,Amsterdam Brewery,Full-Time,"Computer science, Customer service, Call center, No SQL",In-Person,Others,Junior,Toronto,ON,60000.0,90000.0
Python Data Analyst,Data Analyst,TV2 Consulting,Full-Time,"Natural language processing, Data analytics, APIs, Python, Analytics",In-Person,Consulting,ANY,Toronto,ON,145600.0,176800.0
Business Data Analyst,Data Analyst,Edgerise Consulting INC.,Full-Time,"Python, Quality assurance, Usability, Project implementation, IT",In-Person,Technology,ANY,Kitchener,ON,83200.0,93600.0
Data Engineering Analyst,Data Engineer,Seaspan ULC,Full-Time,"Performance tuning, Data modeling, Azure, DevOps, Spark",In-Person,Others,ANY,North Vancouver,BC,69000.0,85000.0
Marketing Data Analyst/Analyste Des Données Marketing,Data Analyst,Playground,Full-Time,"Python, No SQL, SQL, Relational databases, R",In-Person,Others,ANY,Canada,Undef,120537.0,137231.0
Variable Data Programmer - Analyst,Programmer,Formost mediaOne,Full-Time,"SQL, Microsoft Outlook, XML, Visual Basic, Adobe Illustrator",In-Person,Others,ANY,Brampton,ON,40000.0,60000.0
Business Data Analyst,Data Analyst,tomato e-commerce Inc,Full-Time,"SQL, ADP, Python, Office Suite, Statistics",In-Person,Technology,ANY,Scarborough,ON,90480.0,95994.0
Business Intelligence Analyst (Remote - Canada),Business Analyst,Yelp,Full-Time,"Statistics, Data modeling, Business intelligence, Tableau, SQL",Remote,Others,ANY,Remote,Undef,82000.0,230000.0
Senior Data Engineering Analyst,Data Engineer,Loblaw Companies Limited,Full-Time,"Jira, Statistics, Computer science, Data mining, Relational databases",In-Person,Others,Senior,Brampton,ON,80000.0,105000.0
Data Analyst - Informatics And Systems,Data Analyst,Systematic Squad Inc.,Full-Time,"Python, No SQL",In-Person,Technology,ANY,Calgary,AB,62400.0,102722.0
Methods Analyst I - Wellness Data Analyst,Data Analyst,City of Edmonton,Full-Time,"Power BI, SQL, Microsoft Access, Business intelligence, Business analysis",In-Person,Government,ANY,Edmonton,AB,81000.0,101000.0
Program/Data Analyst,Data Analyst,AppleOne,Full-Time,"No SQL, SQL, Microsoft Outlook, Project planning, Writing skills",In-Person,Others,ANY,Vancouver,BC,54000.0,106162.0
Continuous Improvement Analyst,Others Analyst,Gay Lea Foods,Full-Time,"Python, SQL, Supply chain, Visio, Change management",In-Person,Others,ANY,Teeswater,ON,54286.0,95085.0
"Analyst, Human Resources Analytics",Others Analyst,Ontario Health,Full-Time,"Tableau, SQL, Data mining, Statistics, Human resources",In-Person,Healthcare,ANY,Toronto,ON,62000.0,80000.0
Human Resources Systems Analyst,Systems Analyst,Dexterra Group,Full-Time,"SQL, Financial auditing, ADP, HRIS",In-Person,Others,ANY,Toronto,ON,80000.0,92000.0
Bi Analyst,Others Analyst,Fusemachines,Full-Time,"Computer science, Power BI, Data modeling, Business intelligence, Tableau",Remote,Others,ANY,Remote,Undef,43230.0,146536.0
Technical Analyst Ii,Others Analyst,Benevity,Full-Time,"FTP, SFTP, Pentaho, XML, SQL",In-Person,Others,ANY,Calgary,AB,57000.0,62000.0
Developpeur Power-Bi Sénior,Others Analyst,CGI,Full-Time,"Jira, Power BI, Agile, Cloud computing, Chef",In-Person,Others,ANY,Montréal,QC,63000.0,120000.0
"Senior Data System Analyst ( Snowflake, Hadoop, Etl , Informatica)",Systems Analyst,Atlantis IT group,Full-Time,"Performance tuning, Computer science, Oracle, XML, SAS",In-Person,Technology,Senior,Markham,ON,56000.0,100000.0
Senior Business Analyst,Business Analyst,Blacksmith Agency,Full-Time,"Keyword research, Business analysis, Python, Research, Taxonomy",Remote,Agency,Senior,Remote,Undef,44433.0,52631.0
